<?xml version="1.0" encoding="UTF-8"?>
<review xmlns="https://github.com/XML-TIM4/ScientificPublications"
 xmlns:xsi="http://www.w3.org/2001/XMLSchema-instance"
 xsi:schemaLocation="https://github.com/XML-TIM4/ScientificPublications file:/data/schemas/Review.xsd">
    <review-metadata>
        <date>2006-05-04</date>
        <recommendation>accept</recommendation>
        <scientific-paper-id>asdfqwer</scientific-paper-id>
    </review-metadata>
    <questionnaire>
        <question>
            <question-text>question-text0</question-text>
            <answer selected="false">q1a1</answer>
            <answer selected="false">q1a2</answer>
        </question>
        <question>
            <question-text>question-text1</question-text>
            <answer selected="false">q1a1</answer>
            <answer selected="false">q1a2</answer>
            <answer selected="false">q1a3</answer>
        </question>
    </questionnaire>
    <reviewer-comments>
    </reviewer-comments>
    <editor-comments>
        <editor-comment>
            <review-reference>review-reference2</review-reference>
            <comment-text>comment-text2</comment-text>
        </editor-comment>
        <editor-comment>
            <review-reference>review-reference3</review-reference>
            <comment-text>comment-text3</comment-text>
        </editor-comment>
    </editor-comments>
</review>
